{
 "schemaVersion": 1,
 "page": 4,
 "timeWindow": "ma-zo na 20 uur",
 "series": {
  "1100": {
   "headwayMinutes": 30.0,
   "routes": [
    {
     "arr": [
      0.0,
      3.0,
      12.0,
      23.0,
      38.0,
      44.0,
      52.0,
      60.0,
      65.0,
      80.5,
      104.5
     ],
     "dep": [
      0.0,
      5.0,
      12.0,
      26.0,
      40.0,
      44.0,
      52.0,
      60.0,
      66.5,
      82.5,
      104.5
     ]
    }
   ]
  },
  "11400": {
   "headwayMinutes": null,
   "routes": [
    {
     "arr": [
      0.0,
      0.5,
      14.5,
      36.5,
      39.0,
      53.5,
      102.5
     ],
     "dep": [
      0.0,
      0.5,
      21.5,
      38.5,
      40.0,
      59.5,
      102.5
     ]
    }
   ]
  },
  "11800": {
   "headwayMinutes": null,
   "routes": [
    {
     "arr": [
      0.0,
      26.0,
      34.0
     ],
     "dep": [
      0.0,
      27.0,
      34.0
     ]
    }
   ]
  },
  "12400": {
   "headwayMinutes": 60.0,
   "routes": [
    {
     "arr": [
      0.0,
      26.0,
      33.0
     ],
     "dep": [
      0.0,
      27.0,
      33.0
     ]
    }
   ]
  },
  "13900": {
   "headwayMinutes": null,
   "routes": [
    {
     "arr": [
      0.0,
      18.0,
      31.0,
      47.0,
      63.0
     ],
     "dep": [
      0.0,
      18.0,
      32.0,
      48.0,
      63.0
     ]
    }
   ]
  },
  "1400": {
   "headwayMinutes": 60.0,
   "routes": [
    {
     "arr": [
      0.0,
      18.0,
      29.0,
      45.0,
      65.0,
      81.0,
      89.0,
      101.0
     ],
     "dep": [
      0.0,
      18.0,
      31.0,
      49.0,
      67.0,
      82.0,
      89.0,
      101.0
     ]
    }
   ]
  },
  "14800": {
   "headwayMinutes": null,
   "routes": [
    {
     "arr": [
      0.0,
      5.0,
      10.0,
      15.0,
      18.0,
      23.0,
      26.0,
      29.0,
      32.0,
      37.0,
      41.0,
      45.0
     ],
     "dep": [
      0.0,
      5.0,
      10.0,
      15.0,
      19.0,
      23.0,
      26.0,
      29.0,
      32.0,
      38.0,
      41.0,
      45.0
     ]
    }
   ]
  },
  "1500": {
   "headwayMinutes": 30.0,
   "routes": [
    {
     "arr": [
      0.0,
      20.0,
      33.0,
      59.0,
      71.0
     ],
     "dep": [
      0.0,
      22.0,
      33.0,
      61.0,
      71.0
     ]
    }
   ]
  },
  "15800": {
   "headwayMinutes": null,
   "routes": [
    {
     "arr": [
      0.0,
      6.0,
      9.0,
      12.0,
      17.0,
      25.0,
      28.0,
      32.0,
      34.0,
      41.0,
      48.0,
      53.0,
      57.0
     ],
     "dep": [
      0.0,
      6.0,
      9.0,
      12.0,
      19.0,
      25.0,
      28.0,
      32.0,
      35.0,
      41.0,
      49.0,
      53.0,
      57.0
     ]
    }
   ]
  },
  "16100": {
   "headwayMinutes": null,
   "routes": [
    {
     "arr": [
      0.0,
      13.0,
      18.0,
      21.0
     ],
     "dep": [
      0.0,
      13.0,
      18.0,
      21.0
     ]
    }
   ]
  },
  "16500": {
   "headwayMinutes": null,
   "routes": [
    {
     "arr": [
      0.0,
      6.0,
      9.0,
      13.0,
      16.0,
      21.0
     ],
     "dep": [
      0.0,
      6.0,
      9.0,
      13.0,
      16.0,
      21.0
     ]
    }
   ]
  },
  "16900": {
   "headwayMinutes": 60.0,
   "routes": [
    {
     "arr": [
      0.0,
      8.0,
      18.0,
      24.0,
      30.0,
      36.0
     ],
     "dep": [
      0.0,
      9.0,
      19.0,
      24.0,
      34.0,
      36.0
     ]
    }
   ]
  },
  "1700": {
   "headwayMinutes": 30.0,
   "routes": [
    {
     "arr": [
      0.0,
      18.0,
      37.0,
      50.0,
      76.0,
      87.0,
      114.0,
      126.0,
      134.0
     ],
     "dep": [
      0.0,
      19.0,
      37.0,
      52.0,
      77.0,
      89.0,
      115.0,
      127.0,
      134.0
     ]
    }
   ]
  },
  "17800": {
   "headwayMinutes": 60.0,
   "routes": [
    {
     "arr": [
      0.0,
      3.5,
      9.5,
      15.5,
      20.0
     ],
     "dep": [
      0.0,
      3.5,
      10.5,
      15.5,
      20.0
     ]
    }
   ]
  },
  "1800": {
   "headwayMinutes": 30.0,
   "routes": [
    {
     "arr": [
      0.0,
      23.0,
      49.0,
      57.0,
      62.0,
      78.0,
      90.0,
      96.0
     ],
     "dep": [
      0.0,
      23.0,
      50.0,
      58.0,
      62.0,
      79.0,
      92.0,
      96.0
     ]
    }
   ]
  },
  "18900": {
   "headwayMinutes": 60.0,
   "routes": [
    {
     "arr": [
      0.0,
      7.0,
      17.0,
      23.0,
      30.0,
      34.0,
      44.5,
      49.5,
      61.0,
      65.0,
      68.0,
      72.0,
      81.0,
      85.5
     ],
     "dep": [
      0.0,
      8.0,
      18.0,
      24.0,
      32.0,
      39.0,
      44.5,
      49.5,
      61.0,
      65.0,
      68.0,
      73.5,
      82.0,
      85.5
     ]
    }
   ]
  },
  "2000": {
   "headwayMinutes": null,
   "routes": [
    {
     "arr": [
      0.0,
      3.0,
      6.0,
      10.0,
      13.0,
      16.0,
      20.0,
      23.0,
      26.0,
      29.0,
      34.0
     ],
     "dep": [
      0.0,
      3.0,
      6.0,
      10.0,
      13.0,
      16.0,
      20.0,
      23.0,
      26.0,
      31.0,
      34.0
     ]
    },
    {
     "arr": [
      0.0,
      8.0,
      18.0,
      37.0
     ],
     "dep": [
      0.0,
      8.0,
      19.0,
      37.0
     ]
    }
   ]
  },
  "20000": {
   "headwayMinutes": 60.0,
   "routes": [
    {
     "arr": [
      0.0,
      9.0,
      17.0,
      23.0,
      29.0,
      53.0,
      77.0,
      82.0,
      88.0,
      99.0,
      106.0
     ],
     "dep": [
      0.0,
      10.0,
      17.0,
      24.0,
      29.0,
      57.0,
      77.0,
      83.0,
      89.0,
      99.0,
      106.0
     ]
    },
    {
     "arr": [
      0.0,
      4.0,
      8.0,
      11.0,
      15.0,
      21.0,
      31.0,
      51.0,
      65.0
     ],
     "dep": [
      0.0,
      5.0,
      9.0,
      12.0,
      16.0,
      22.0,
      40.0,
      52.0,
      65.0
     ]
    }
   ]
  },
  "20200": {
   "headwayMinutes": 30.0,
   "routes": [
    {
     "arr": [
      0.0,
      4.0,
      6.0,
      11.0,
      17.0,
      22.0,
      28.0,
      29.5,
      35.0,
      36.5,
      40.0,
      41.5,
      43.5,
      47.0,
      53.5,
      56.5,
      58.0,
      62.5,
      67.0,
      68.5,
      74.5,
      78.0,
      86.0,
      88.0,
      92.0,
      99.0,
      104.0,
      107.0,
      110.0,
      117.0
     ],
     "dep": [
      0.0,
      4.0,
      7.0,
      12.0,
      19.0,
      23.0,
      29.0,
      29.5,
      36.0,
      37.5,
      40.0,
      41.5,
      44.5,
      53.0,
      53.5,
      57.5,
      59.0,
      63.5,
      68.0,
      69.5,
      74.5,
      81.0,
      86.0,
      89.0,
      92.0,
      101.0,
      104.0,
      107.0,
      111.0,
      117.0
     ]
    }
   ]
  },
  "20300": {
   "headwayMinutes": 60.0,
   "routes": [
    {
     "arr": [
      0.0,
      8.0,
      18.0,
      37.0,
      69.0,
      71.0,
      97.0,
      133.0
     ],
     "dep": [
      0.0,
      8.0,
      22.0,
      40.0,
      69.0,
      73.0,
      98.0,
      133.0
     ]
    }
   ]
  },
  "2100": {
   "headwayMinutes": 30.0,
   "routes": [
    {
     "arr": [
      0.0,
      5.0,
      15.0,
      22.0,
      37.0,
      53.0
     ],
     "dep": [
      0.0,
      5.0,
      17.0,
      22.0,
      42.0,
      53.0
     ]
    }
   ]
  },
  "21400": {
   "headwayMinutes": null,
   "routes": [
    {
     "arr": [
      0.0,
      null,
      null,
      null,
      null,
      null,
      null,
      null,
      null,
      null,
      null,
      null,
      null,
      null,
      null,
      null,
      null,
      null
     ],
     "dep": [
      0.0,
      null,
      null,
      null,
      null,
      null,
      null,
      null,
      null,
      null,
      null,
      null,
      null,
      null,
      null,
      null,
      null,
      null
     ]
    }
   ]
  },
  "2200": {
   "headwayMinutes": 60.0,
   "routes": [
    {
     "arr": [
      0.0,
      5.0,
      15.0,
      22.0,
      37.0,
      48.0,
      52.0,
      60.0,
      68.0,
      73.0,
      79.0,
      91.0,
      96.0,
      104.0,
      111.0,
      112.0,
      131.5,
      138.5,
      153.5,
      164.5,
      168.5,
      174.5,
      179.5,
      184.5,
      194.5,
      199.5,
      203.5,
      207.5
     ],
     "dep": [
      0.0,
      5.0,
      17.0,
      22.0,
      40.0,
      49.0,
      53.0,
      60.0,
      68.0,
      76.0,
      79.0,
      92.0,
      96.0,
      104.0,
      111.0,
      131.0,
      131.5,
      144.5,
      154.5,
      164.5,
      168.5,
      174.5,
      179.5,
      185.5,
      194.5,
      199.5,
      203.5,
      207.5
     ]
    },
    {
     "arr": [
      0.0,
      5.0,
      11.0,
      17.0,
      23.0
     ],
     "dep": [
      0.0,
      5.0,
      12.0,
      17.0,
      23.0
     ]
    }
   ]
  },
  "2300": {
   "headwayMinutes": 60.0,
   "routes": [
    {
     "arr": [
      0.0,
      5.0,
      15.0,
      22.0,
      37.0,
      47.0,
      51.0,
      59.0,
      67.0,
      72.0,
      78.0,
      90.0,
      113.0
     ],
     "dep": [
      0.0,
      5.0,
      17.0,
      22.0,
      39.0,
      48.0,
      52.0,
      59.0,
      67.0,
      75.0,
      78.0,
      91.0,
      113.0
     ]
    }
   ]
  },
  "2400": {
   "headwayMinutes": 60.0,
   "routes": [
    {
     "arr": [
      0.0,
      27.0,
      34.0,
      40.0,
      57.0
     ],
     "dep": [
      0.0,
      28.0,
      36.0,
      40.0,
      57.0
     ]
    }
   ]
  },
  "2550": {
   "headwayMinutes": 60.0,
   "routes": [
    {
     "arr": [
      0.0,
      4.0,
      8.0,
      14.0,
      17.0,
      20.0,
      25.5,
      30.0,
      35.5,
      40.5,
      48.5,
      51.5,
      55.5,
      58.5,
      61.5,
      67.5,
      70.5,
      72.5,
      77.5,
      81.5,
      91.5
     ],
     "dep": [
      0.0,
      4.0,
      9.5,
      14.0,
      17.0,
      20.0,
      25.5,
      31.0,
      36.5,